{"$schema":"https://json-schema.org/draft/2020-12/schema","$id":"https://llm-router.local/contracts/stats.schema.json","type":"object","required":["timestamp","window_seconds","requests_total","avg_latency_ms","cache","swaps","by_model","recent","queue_depth"],"properties":{"timestamp":{"type":"string","format":"date-time"},"window_seconds":{"type":"integer"},"requests_total":{"type":"integer","minimum":0},"avg_latency_ms":{"type":"number","minimum":0},"cache":{"type":"object","required":["hits","misses","hit_rate"],"properties":{"hits":{"type":"integer"},"misses":{"type":"integer"},"hit_rate":{"type":"number","minimum":0,"maximum":1}}},"swaps":{"type":"integer","minimum":0},"by_model":{"type":"array","items":{"type":"object","required":["model","tier","count","avg_latency_ms"],"properties":{"model":{"type":"string"},"tier":{"enum":["light","code","heavy"]},"count":{"type":"integer"},"avg_latency_ms":{"type":"number"},"p95_latency_ms":{"type":"number"}}}},"recent":{"type":"array","items":{"type":"object","required":["id","timestamp","model","tier","score","intent","reason","latency_ms","cache"],"properties":{"id":{"type":"string"},"timestamp":{"type":"string","format":"date-time"},"model":{"type":"string"},"tier":{"enum":["light","code","heavy"]},"score":{"type":"integer"},"intent":{"enum":["chat","code","reasoning"]},"reason":{"type":"string"},"latency_ms":{"type":"number"},"cache":{"enum":["hit","miss","bypass"]}}}},"queue_depth":{"type":"object","additionalProperties":{"type":"integer"}},"loaded_model":{"type":["string","null"]},"gpu":{"type":"object","properties":{"vram_used_bytes":{"type":["integer","null"]},"vram_total_bytes":{"type":["integer","null"]},"utilization_pct":{"type":["number","null"]}}},"estimated_savings":{"type":"object","properties":{"basis":{"const":"calibrated-estimate"},"time_ms":{"type":"number"},"pct_vs_heavy_only":{"type":"number"}}}}}