{"timestamp":"2026-10-17T12:00:00.000Z","window_seconds":300,"requests_total":1,"avg_latency_ms":31,"cache":{"hits":0,"misses":1,"hit_rate":0},"swaps":0,"by_model":[{"model":"gemma3:4b","tier":"light","count":1,"avg_latency_ms":31,"p95_latency_ms":31}],"recent":[{"id":"00000000-0000-4000-8000-000000000002","timestamp":"2026-10-17T12:00:00.000Z","model":"gemma3:4b","tier":"light","score":12,"intent":"chat","reason":"short factual question","latency_ms":31,"cache":"miss"}],"queue_depth":{"gemma3:4b":0},"loaded_model":"gemma3:4b","gpu":{"vram_used_bytes":null,"vram_total_bytes":null,"utilization_pct":null},"estimated_savings":{"basis":"calibrated-estimate","time_ms":0,"pct_vs_heavy_only":0}}